{
  "$schema": "https://json-schema.org/draft/2020-12/schema",
  "$id": "https://tinybattery.local/schemas/icon-theme.schema.json",
  "title": "TinyBattery Icon Theme",
  "description": "A battery icon theme. Classic themes recolor the built-in vector icon; imageSet themes provide images per battery level.",
  "type": "object",
  "required": ["schemaVersion", "id", "name", "kind"],
  "additionalProperties": false,
  "properties": {
    "$schema": { "type": "string" },
    "schemaVersion": { "const": 1 },
    "id": {
      "type": "string",
      "pattern": "^[a-z0-9][a-z0-9._-]*$",
      "minLength": 1,
      "maxLength": 128
    },
    "name": { "type": "string", "minLength": 1, "maxLength": 200 },
    "version": { "type": "string", "maxLength": 64 },
    "author": { "type": "string", "maxLength": 200 },
    "description": { "type": "string", "maxLength": 2000 },
    "kind": { "enum": ["classic", "imageSet", "xaml", "plugin"] },
    "size": { "type": "integer", "minimum": 16, "maximum": 256, "default": 32 },
    "preview": { "type": "string", "maxLength": 512 },
    "appIcon": { "type": "string", "maxLength": 512 },
    "classic": {
      "type": "object",
      "additionalProperties": false,
      "properties": {
        "healthyThreshold": { "type": "integer", "minimum": 0, "maximum": 100 },
        "warningThreshold": { "type": "integer", "minimum": 0, "maximum": 100 },
        "healthyColor": { "type": "string", "pattern": "^#[0-9A-Fa-f]{6}$" },
        "warningColor": { "type": "string", "pattern": "^#[0-9A-Fa-f]{6}$" },
        "criticalColor": { "type": "string", "pattern": "^#[0-9A-Fa-f]{6}$" },
        "unknownColor": { "type": "string", "pattern": "^#[0-9A-Fa-f]{6}$" },
        "unknownFillRatio": { "type": "number", "minimum": 0, "maximum": 1 }
      }
    },
    "levels": {
      "type": "array",
      "minItems": 1,
      "maxItems": 101,
      "items": {
        "type": "object",
        "required": ["minPercent", "asset"],
        "additionalProperties": false,
        "properties": {
          "minPercent": { "type": "integer", "minimum": 0, "maximum": 100 },
          "asset": { "type": "string", "minLength": 1, "maxLength": 512 },
          "smallAsset": { "type": "string", "minLength": 1, "maxLength": 512 }
        }
      }
    },
    "unknown": { "type": "string", "maxLength": 512 },
    "unknownSmall": { "type": "string", "maxLength": 512 },
    "chargingOverlay": { "type": "string", "maxLength": 512 },
    "metadata": {
      "type": "object",
      "additionalProperties": { "type": "string" },
      "maxProperties": 32
    }
  },
  "allOf": [
    {
      "if": {
        "properties": { "kind": { "const": "imageSet" } },
        "required": ["kind"]
      },
      "then": { "required": ["levels"] }
    }
  ]
}
