{
  "$schema": "../../../schemas/icon-theme.schema.json",
  "schemaVersion": 1,
  "id": "classic-images",
  "name": "Classic Images",
  "version": "1.0.1",
  "author": "TinyBattery",
  "description": "Image-set example using the exported Classic icons, with dedicated 16px assets.",
  "kind": "imageSet",
  "preview": "full.png",
  "levels": [
    { "minPercent": 90, "asset": "full.png", "smallAsset": "full-16.png" },
    { "minPercent": 60, "asset": "high.png", "smallAsset": "high-16.png" },
    { "minPercent": 20, "asset": "mid.png", "smallAsset": "mid-16.png" },
    { "minPercent": 0, "asset": "low.png", "smallAsset": "low-16.png" }
  ],
  "unknown": "unknown.png",
  "unknownSmall": "unknown-16.png"
}
